"The Brontë story : A reconsideration of Mrs Gaskell's Life of Charlotte Brontë, etc","Life of Charlotte Brontë","002067858","Monograph","Language material ; Text","Volume","","","","Lane, Margaret","1907-1994","person","","Lane, Margaret, 1907-1994 [person] ; Gaskell, Elizabeth Cleghorn, 1810-1865 [person]","Fontana books","number 1966 [Fontana books]","England ; Scotland","Glasgow ; London","Collins","1969","","315 pages, illustrations, 18 cm","","X.908/17855","Brontë, Charlotte, 1816-1855","","English","",""
"The Brontë story : a reconsideration of Mrs. Gaskell's 'Life of Charlotte Brontë","Life of Charlotte Brontë","010321099","Monograph","Language material ; Text","Volume","GB6911286","","9780006119661","Gaskell, Elizabeth Cleghorn","1810-1865","person","","Gaskell, Elizabeth Cleghorn, 1810-1865 [person]","","","England","London","Fontana","1969","","315 pages, illustrations, 18 cm","8238","","Brontë, Charlotte, 1816-1855--Biography","","English","Includes excerpts from Mrs. Gaskell's 'Life' ; Originally published (B53-1970), London: Heinemann, 1953",""
"The Brontë story : a reconsideration of Mrs. Gaskell's Life of Charlotte Brontë","","002067857","Monograph","Language material ; Text","Volume","","","","Lane, Margaret","1907-1994","person","","Hassall, Joan [person] ; Lane, Margaret, 1907-1994 [person]","","","England","London","William Heinemann","1953","","x, 284 pages, illustrations (8°)","","10863.ee.6 ; W3/2726","Brontë, Charlotte, 1816-1855 ; Gaskell, Elizabeth Cleghorn, 1810-1865","","English","",""
"The Brontës : Charlotte Brontë: Stories from Angria, The professor, Emma, Poems ; Emily Brontë: Poems ; Anne Brontë: Poems","Albion and Marina ; Emma ; Farewell to Angria ; Mina Laury ; Poems ; Professor","019436973","Monograph","Language material ; Text","Volume","","","","","","","","Brontë, Anne, 1820-1849 [person] ; Brontë, Emily, 1818-1848 [person] ; Brontë, Charlotte, 1816-1855 [person] ; Bentley, Phyllis Eleanor, 1894-1977, writer [person]","","","England","London","Allan Wingate","1949","Heather edition, arranged and introduced by Phyllis Bentley","462 pages, 19 cm","","W73/4094","","","English","",""
"The Brontës : a collection of critical essays","","007679874","Monograph","Language material ; Text","Volume","GB7109792","","9780130838810 ; 9780130838995","","","","","Gregor, Ian, editor [person]","Twentieth century views","","England ; United States of America","Englewood Cliffs ; Hemel Hempstead","Prentice Hall","1970","","vii, 179 pages, 21 cm","823.8","11880.bb.2/83 ; 72/7279 ; A70/4473","Brontë, Emily, 1818-1848 ; Brontë, Anne, 1820-1849 ; Brontë, Patrick Branwell, 1817-1848 ; Brontë, Charlotte, 1816-1855 ; Brontë family","","English","With special reference to Charlotte, Branwell, Emily and Anne Brontë. Also numbered as S-TC 92 in the 'Spectrum book' series",""
"The Brontës : a life in letters","","011347800","Monograph","Language material ; Text","Volume","GB97X7738","","9780670872121","Barker, Juliet R. V.","","person","author","Barker, Juliet R. V., author [person]","","","England","London","Viking","1997","","xxx, 414 pages, 16 pages of plates, illustrations, facsimiles, portraits, 25 cm","826.808","98/05309 ; YC.1998.b.2191","Brontë, Emily, 1818-1848--Correspondence ; Women authors, English--19th century--Correspondence ; Authors, English--19th century--Correspondence ; Brontë, Charlotte, 1816-1855--Correspondence ; Brontë, Anne, 1820-1849--Correspondence ; Brontë family--Correspondence ; Yorkshire (England)--Biography","Correspondence","English","Includes indexes",""
"The Brontës : a life in letters","","013491727","Monograph","Language material ; Text","Volume","GBA677424","","","Barker, Juliet R. V.","","person","author","Barker, Juliet R. V., author [person]","","","England","London","Folio Society","2006","","xxxii, 442 pages, 16 pages of plates, illustrations, portraits, 25 cm","826.808","YK.2006.a.15046","Brontë, Emily, 1818-1848--Correspondence ; Women authors, English--19th century--Correspondence ; Brontë, Charlotte, 1816-1855--Correspondence ; Authors, English--19th century--Correspondence ; Brontë, Anne, 1820-1849--Correspondence ; Brontë family--Correspondence ; Brontë, Patrick Branwell, 1817-1848--Correspondence ; Yorkshire (England)--Biography","Biography ; Correspondence","English","In slip case ; Includes index ; Originally published: Penguin, 1997",""
"The Brontës : a life in letters","","017725722","Monograph","Language material ; Text","Volume","GBB616060","","9781408708316","Barker, Juliet R. V.","","person","author","Barker, Juliet R. V., author [person]","","","England","London","Little, Brown","2016","","xxxix, 418 pages, 16 unnumbered pages of plates, illustrations, 24 cm","823.809","","Novelists, English--19th century--Correspondence ; Brontë, Emily, 1818-1848--Correspondence ; Brontë, Charlotte, 1816-1855--Correspondence ; Brontë, Anne, 1820-1849--Correspondence ; Brontë family--Correspondence","Correspondence","English","Additional physical form: ebook version. 9781408708309 ; First published: London: Viking, 1997 ; Includes indexes",""
"The Brontës : a life in letters","","017797822","Monograph","Language material ; Text","Online resource (ePub ebook)","GBB649249","","9781408708309","Barker, Juliet R. V.","","person","author","Barker, Juliet R. V., author [person]","","","England","London","Little, Brown","2016","","1 online resource","823.809","ELD.DS.64128","Novelists, English--19th century--Correspondence ; Brontë, Emily, 1818-1848--Correspondence ; Brontë, Charlotte, 1816-1855--Correspondence ; Brontë, Anne, 1820-1849--Correspondence ; Brontë family--Correspondence","Correspondence","English","Additional physical form: Print version. 9781408708316 ; First published: London: Viking, 1997 ; Includes indexes",""
"The Brontës : children of the Moors : a picture book","","017693858","Monograph","Language material ; Still image ; Text","Volume","GBB602285","","9781445147314","Manning, Mick","","person","author","Manning, Mick, author [person] ; Granström, Brita, author [person]","","","England","London","Franklin Watts","2016","","1 volume, illustrations, 24 x 30 cm","823.809","","Brontë, Emily, 1818-1848--Pictorial works--Juvenile literature ; Brontë, Charlotte, 1816-1855--Pictorial works--Juvenile literature ; Brontë, Anne, 1820-1849--Pictorial works--Juvenile literature","Children's literature ; Pictorial work","English","",""
"The Brontës : children of the Moors : a picture book","","019495129","Monograph","Language material ; Still image ; Text","Volume","GBB9D4318","","9781445147321","Manning, Mick","","person","author ; illustrator","Granström, Brita, author ; illustrator [person] ; Manning, Mick, author ; illustrator [person]","","","England","London","Franklin Watts","2019","","1 volume, illustrations, 30 cm","823.809","","Brontë, Emily, 1818-1848--Pictorial works--Juvenile literature ; Authors, English--19th century--Biography--Juvenile literature ; Women authors, English--19th century--Biography--Juvenile literature ; Brontë, Charlotte, 1816-1855--Pictorial works--Juvenile literature ; Brontë, Anne, 1820-1849--Pictorial works--Juvenile literature","Biography ; Children's literature ; Pictorial work","English","",""
"The Brontës : selected poems : notes","","014627239","Monograph","Language material ; Text","Volume","GBA871171","","9781405896191","Eddy, Steve","","person","author","Eddy, Steve, author [person]","York notes advanced","","England","Harlow","Longman","2008","","134 pages, 21 cm","821.809","YK.2009.a.29334","Brontë, Anne, 1820-1849--Criticism and interpretation ; Brontë, Patrick Branwell, 1817-1848--Criticism and interpretation ; Brontë, Charlotte, 1816-1855--Criticism and interpretation ; Brontë, Emily, 1818-1848--Criticism and interpretation ; English poetry--19th century--History and criticism","","English","",""
"The Brontës : selected poems","Poems","016529446","Monograph","Language material ; Text","Volume","GBB398674","","9780198393412","","","","","Brontë, Anne, 1820-1849 [person] ; Cross, Helen, 1959-, editor [person] ; Brontë, Patrick Branwell, 1817-1848 [person] ; Brontë, Emily, 1818-1848 [person] ; Brontë, Charlotte, 1816-1855 [person]","Oxford student texts","","England","Oxford","Oxford University Press","2014","","vii, 168 pages, black and white illustrations, 20 cm","821.809","YC.2014.a.11500","Brontë, Anne, 1820-1849--Criticism and interpretation ; Brontë, Patrick Branwell, 1817-1848--Criticism and interpretation ; Brontë, Charlotte, 1816-1855--Criticism and interpretation ; Brontë, Emily, 1818-1848--Criticism and interpretation ; English poetry--19th century--History and criticism","","English","",""
"The Brontës : the critical heritage","","012611227","Monograph","Language material ; Text","Volume","GB9640300","","9780415134613","","","","","Allott, Miriam Farris, editor [person]","Critical heritage series","","England","London","Routledge","1995","","xx, 475 pages, 23 cm","823.809","YC.1996.a.2688","Brontë, Emily, 1818-1848--Criticism and interpretation--History--19th century ; Brontë, Anne, 1820-1849--Criticism and interpretation--History--19th century ; Brontë, Charlotte, 1816-1855--Criticism and interpretation--History--19th century ; Brontë family ; English fiction","","English","bibliography: p. 461-463. - Includes index",""
"The Brontës : the fantastically feminist (and totally true) story of the astonishing authors","","019210987","Monograph","Language material ; Text","Volume","GBB909893","","9781526361066","Doherty, Anna","","person","author","Doherty, Anna, author [person]","","","England","London","Wren & Rook","2019","","1 volume, 27 cm","823.809","","Brontë, Emily, 1818-1848--Juvenile literature ; Brontë, Charlotte, 1816-1855--Juvenile literature ; English fiction--19th century--History and criticism--Juvenile literature ; Brontë, Anne, 1820-1849--Juvenile literature","Children's literature","English","Additional physical form: ebook version. 9781526361080",""
"The Brontës : the fantastically feminist (and totally true) story of the astonishing authors","","019212981","Monograph","Language material ; Text","Online resource (ebook)","GBB911887","","9781526361080","Doherty, Anna","","person","author","Doherty, Anna, author [person]","","","England","London","Wren & Rook","2019","","1 online resource","823.809","ELD.DS.410520","Brontë, Emily, 1818-1848--Juvenile literature ; Brontë, Charlotte, 1816-1855--Juvenile literature ; English fiction--19th century--History and criticism--Juvenile literature ; Brontë, Anne, 1820-1849--Juvenile literature","Children's literature","English","Additional physical form: Print version. 9781526361066",""
"The Brontës : their complete novels in one sitting","","016566272","Monograph","Language material ; Text","Volume","GBB470298","","9780762448449","Kasius, Jennifer","","person","author","Kasius, Jennifer, author [person] ; De La Hoz, Cindy, editor [person]","","","United States of America","Philadelphia","Running","2013","","199 pages, black and white illustrations, 90 mm","823.8","YKL.2014.a.5313","Miniature books--Specimens ; Brontë, Emily, 1818-1848--Stories, plots, etc ; Brontë, Charlotte, 1816-1855--Stories, plots, etc ; Brontë, Anne, 1820-1849--Stories, plots, etc","Specimen","English","illustrations on inside front cover; repeated on inside back cover",""
"The Brontës A to Z : the essential reference to their lives and work","","007417211","Monograph","Language material ; Text","Volume","GBA400080","","9780816043026 ; 9780816043033","Paddock, Lisa Olson","","person","","Rollyson, Carl E. (Carl Edmund) [person] ; Paddock, Lisa Olson [person]","","","England ; United Kingdom ; United States of America","New York","Facts on File","2003","","xvii, 252 pages, illustrations, map, 29 cm","823.809","YC.2004.b.43","Brontë, Emily, 1818-1848--Encyclopedias ; Brontë, Charlotte, 1816-1855--Encyclopedias ; Women authors, English--Biography--Encyclopedias ; Women and literature--England--History--19th century--Encyclopedias ; Brontë, Anne, 1820-1849--Encyclopedias ; Brontë family--Encyclopedias ; Authors, English--19th century--Biography--Encyclopedias ; Yorkshire (England)--In literature--Encyclopedias ; Yorkshire (England)--Biography--Encyclopedias","Biography ; Encyclopaedia","English","",""
"The Brontës and education : papers presented to the Brontë Society weekend conference, September 2004","","013406698","Monograph","Language material ; Text","Volume","GBA626286","","","Brontë Society Weekend Conference, Haworth, England","2004","meeting/conference","","Brontë Society [organisation] ; Duckett, R. J. (Robert John), editor [person] ; Brontë Society Weekend Conference, Haworth, England, 2004 [meeting/conference]","Brontë Society occasional publications","number 10 [Brontë Society occasional publications]","England","Haworth","Brontë Society","2005","","100 pages, illustrations, 21 cm","823.8","YK.2006.a.6301","Brontë, Anne, 1820-1849--Congresses ; Brontë, Emily, 1818-1848--Congresses ; Brontë, Charlotte, 1816-1855--Congresses ; Education--England--Haworth--History--19th century","Congress","English","",""
"The Brontës and education","","013752333","Monograph","Language material ; Text","Volume","GBA739877","","9780521832892","Thormählen, Marianne","1949-","person","author","Thormählen, Marianne, 1949-, author [person]","","","England","Cambridge","Cambridge University Press","2007","","xii, 304 pages, 24 cm","823.8093557","YC.2007.a.13851 ; m07/.26230","Brontë, Anne, 1820-1849--Criticism and interpretation ; Brontë, Charlotte, 1816-1855--Criticism and interpretation ; Education in literature ; English fiction--19th century--History and criticism ; Brontë, Emily, 1818-1848--Criticism and interpretation ; Educational equalization--Great Britain--History--19th century","","English","",""
"The Brontës and education","","015529492","Monograph","Language material ; Text","Volume","GBB049549","","9780521155618","Thormählen, Marianne","1949-","person","","Thormählen, Marianne, 1949- [person]","","","England","Cambridge","Cambridge University Press","2010","","1 volume, 23 cm","823.8093557","","Brontë, Anne, 1820-1849--Criticism and interpretation ; Brontë, Charlotte, 1816-1855--Criticism and interpretation ; Education in literature ; English fiction--19th century--History and criticism ; Brontë, Emily, 1818-1848--Criticism and interpretation ; Educational equalization--Great Britain--History--19th century","","English","Originally published: 2007",""
"The Brontës and music","Branwell Brontë's flute book ; Brontës' world of music","014761640","Monograph","Notated music ; Text","Volume","","","9784841931365 ; 9784841931372 ; 9784841931808","Higuchi, Akiko","","person","","Brontë Parsonage Museum, Bonnell 133 [organisation] ; Higuchi, Akiko [person]","","","Japan","Tokyo","Yushodo","2008","2nd edition","1 score (386 pages) + 1 book (380 pages), 27 cm (in slip case)","780","E.1920.p","Brontë, Anne, 1820-1849--Criticism and interpretation ; Hymns, English ; Brontë, Emily, 1818-1848 ; Sacred songs with piano ; Brontë, Emily, 1818-1848--Knowledge--Music ; Songs with piano ; Brontë, Charlotte, 1816-1855--Knowledge--Music ; Brontë, Charlotte, 1816-1855--Criticism and interpretation ; Brontë, Anne, 1820-1849--Knowledge--Music ; Flute music ; Music in literature","","","volume 1 is an edition of two collections of hymns, songs, arias, traditional songs and tunes, etc, the first collection for voice and unfigured bass or piano, the second for unaccompanied flute. The original manuscript form respectively Bonnell manuscript 133 & 56 in the Brontë Parsonage Museum Library ; volume 2 is a monograph",""
"The Brontës and religion","","009413887","Monograph","Language material ; Text","Volume","GB9976063","","9780521661553","Thormählen, Marianne","","person","","Thormählen, Marianne [person]","","","England","Cambridge","Cambridge University Press","1999","","x, 287 pages, 24 cm","823.8093823","YC.1999.b.8650","English fiction--Women authors--History and criticism ; English fiction--19th century--History and criticism ; Brontë, Anne, 1820-1849--Religion ; Christian fiction, English--History and criticism ; Clergy in literature ; Women and literature--England--History--19th century ; Theology in literature ; Christianity and literature--England--History--19th century ; Brontë, Charlotte, 1816-1855--Religion ; Brontë, Emily, 1818-1848--Religion","","English","",""
"The Brontës and the idea of the human : science, ethics, and the Victorian imagination","","019220581","Monograph","Language material ; Text","Volume","GBB914285","","9781107154810","","","","","Lewis, Alexandra, 1981-, editor [person]","Cambridge studies in nineteenth-century literature and culture","","England ; United States of America","Cambridge ; New York","Cambridge University Press","2019","","xiii, 290 pages, illustrations, 24 cm","823.8","YC.2020.a.612","Bronte, Emily, 1818-1848--Criticism and interpretation ; Humanity in literature ; Brontë family ; Authors, English--19th century ; Bronte, Anne, 1820-1849--Criticism and interpretation ; Bronte, Charlotte, 1816-1855--Criticism and interpretation ; English literature--19th century--History and criticism","","English","",""
"The Brontës and their circle","","003373390","Monograph","Language material ; Text","Volume","","","","Shorter, Clement King","1857-1926","person","","Shorter, Clement King, 1857-1926 [person]","","","England","London","J M Dent","1914","","475 pages, 1 portrait, 18 cm","","012206.i.1/17","Brontë family ; Brontë, Charlotte, 1816-1855","","English","First published in 1893 with title: Charlotte Brontë and her circle",""
"The Brontës and war : fantasy and conflict in Charlotte and Branwell Brontë's youthful writings","","019590784","Monograph","Language material ; Still image ; Text","Volume","GBB9H7201","","9783319956350","Butcher, Emma","","person","author","Butcher, Emma, author [person]","","","England","Basingstoke","Palgrave Macmillan","2019","","1 volume, black and white illustrations, 21 cm","820.9358109034","","Militarism in literature ; Brontë, Charlotte, 1816-1855--Criticism and interpretation ; Brontë, Patrick Branwell, 1817-1848--Criticism and interpretation ; Masculinity in literature","","English","Additional physical form: ebook version. 9783319956367",""
"The Brontës and war : fantasy and conflict in Charlotte and Branwell Brontë's youthful writings","","019591603","Monograph","Language material ; Still image ; Text","Online resource (PDF ebook)","GBB9H8018","","9783319956367","Butcher, Emma","","person","author","Butcher, Emma, author [person]","","","England","Basingstoke","Palgrave Macmillan","2019","","1 online resource, black and white illustrations","820.9358109034","ELD.DS.477403","Militarism in literature ; Brontë, Charlotte, 1816-1855--Criticism and interpretation ; Brontë, Patrick Branwell, 1817-1848--Criticism and interpretation ; Masculinity in literature","","English","Additional physical form: Print version. 9783319956350",""
"The Brontës at Haworth : the world within","","008747918","Monograph","Language material ; Text","Volume","GB9519469","","9780517592670","","","","","Brontë, Anne, 1820-1849 [person] ; Brontë, Emily, 1818-1848 [person] ; Gardiner, Juliet, 1943- [person] ; Brontë, Charlotte, 1816-1855 [person]","","","England ; United States of America","London ; New York","Clarkson Potter ; Random House","1992","","160 pages, illustrations (some colour), 20 x 26 cm","823.809","LB.31.a.5800","West Yorkshire (England) ; Brontë, Emily, 1818-1848--Homes and haunts--England--Haworth ; Haworth (England)--Biography ; Brontë, Charlotte, 1816-1855--Homes and haunts--England--Haworth ; Haworth (England) in literature ; Brontë family ; English fiction ; Brontë, Anne, 1820-1849--Homes and haunts--England--Haworth ; Literary landmarks--England--Haworth ; Authors, English--19th century--Biography","","English","",""
"The Brontës at Haworth","","016225079","Monograph","Language material ; Text","Volume","GBB2C2352","","9780711233980","Dinsdale, Ann","","person","","Dinsdale, Ann [person] ; Warner, Simon, 1951- [person]","","","England","London","Frances Lincoln","2013","","160 pages, illustrations, 25 cm","823.809","","Brontë, Emily, 1818-1848 ; Brontë, Charlotte, 1816-1855 ; Haworth (England)--Social life and customs--19th century ; Novelists, English--19th century--Biography ; Novelists, English--19th century--Homes and haunts--England--Haworth ; Haworth (England)--History--19th century","Biography","English","",""
"The Brontës by the sea : including walks : an account of Charlotte and Anne Brontë's visits to the East and North Yorkshire Coast","","009485681","Monograph","Language material ; Text","Volume","GB9857191","","9780953084104","Petersen, Rhonda","","person","","Petersen, Rhonda [person]","","","England","Bridlington","Bretlington Publishing","1997","","72 pages, illustrations, maps, portraits, 21 cm","796.51094283","YC.1998.a.3625","Brontë, Anne, 1820-1849 ; Brontë, Charlotte, 1816-1855 ; Trails--England--Humberside ; North Yorkshire (England)--Guidebooks ; Humberside (England)--Description--Guide-books ; Trails--England--North Yorkshire","Guidebook","English","",""
"The Brontës in Brussels","","016606251","Monograph","Language material ; Text","Volume","GBB5G1433","","9780720615883","MacEwan, Helen","","person","author","MacEwan, Helen, author [person]","","","England","London","Peter Owen","2014","","218 pages, illustrations (some colour), 22 cm","823.809","YK.2015.a.4025","Brontë family ; Brontë, Emily, 1818-1848--Homes and haunts--Belgium--Brussels ; Brontë, Charlotte, 1816-1855--Homes and haunts--Belgium--Brussels","","English","",""
"The Brontës in Brussels","","018223627","Monograph","Language material ; Text","Online resource","GBB726009","","9780720614442 ; 9780720614466","MacEwan, Helen","","person","","MacEwan, Helen [person]","","","England","London","Peter Owen","2014","","1 online resource (211 pages)","823.809","ELD.DS.117441","Brontë, Emily, 1818-1848--Homes and haunts--Belgium--Brussels ; Literary landmarks--Belgium--Brussels ; Brontë, Charlotte, 1816-1855 ; LITERARY CRITICISM--European--English, Irish, Scottish, Welsh ; Travel ; Brussels (Belgium)--Description and travel ; Brontë, Charlotte, 1816-1855--Homes and haunts--Belgium--Brussels","","English","",""
"The Brontës in the English Lake District","","017973660","Monograph","Cartographic image ; Language material ; Still image ; Text","Volume","GBB835478","","9780993596704","Pentecost, Allan","","person","author","Pentecost, Andrea J., illustrator [person] ; Pentecost, Allan, author [person]","","","England","Norwich","Cloudberry","2016","","87 pages, illustrations (black and white and colour), black and white maps, 25 cm","823.8","YKL.2018.b.402","Brontë, Charlotte, 1816-1855--Homes and haunts--England--Lake District ; Lake District (England)--In literature ; Brontë, Patrick Branwell, 1817-1848--Homes and haunts--England--Lake District ; Brontë, Emily, 1818-1848--Homes and haunts--England--Lake District","","English","Includes index",""
"The Brontës in the world of the arts","","014519659","Monograph","Language material ; Text","Volume","GBA817968","","9780754657521","","","","","Hagan, Sandra, 1964-, editor [person] ; Wells, Juliette, 1977-, editor [person]","The nineteenth century series","","England","Aldershot","Ashgate","2008","","xii, 256 pages, illustrations, 24 cm","823.8","YC.2009.a.813 ; m09/.23979","Authors as artists--England ; Women and literature--England--History--19th century ; Brontë family ; Brontë, Anne, 1820-1849--Knowledge--Art ; Brontë, Emily, 1818-1848--Knowledge--Art ; Brontë, Charlotte, 1816-1855--Knowledge--Art","","English","",""
"The Brontës in the world of the arts","","018137568","Monograph","Language material ; Text","Online resource","GBB7N6362","","9781351893503","","","","","Wells, Juliette, 1977- [person] ; Hagan, Sandra, 1964- [person]","The nineteenth century series","","","","Routledge","2016","","1 online resource (270 pages)","823.8","ELD.DS.103802","Authors as artists--England ; Women and literature--England--History--19th century ; Brontë family ; Brontë, Anne, 1820-1849--Knowledge--Art ; Brontë, Emily, 1818-1848--Knowledge--Art ; Brontë, Charlotte, 1816-1855--Knowledge--Art","","English","",""
"The Brontës treasury","","018827772","Monograph","Language material ; Text","Volume","GBB864971","","9780233005546","O'Neill, Jane","","person","author","O'Neill, Jane, author [person]","","","England","London","Andre Deutsch","2018","","1 volume, 21 cm","823.809","","Brontë, Anne, 1820-1849--Criticism and interpretation ; Women novelists, English--19th century ; Brontë, Charlotte, 1816-1855--Criticism and interpretation ; English fiction--19th century--History and criticism ; Brontë, Emily, 1818-1848--Criticism and interpretation","","English","",""
"The Brontës","","008041224","Monograph","Language material ; Text","Volume","GB98V5116","","9780237517441","Orme, David","1948 March 1-","person","","Orme, David, 1948 March 1- [person]","Writers in Britain","","England","London","Evans","1999","","32 pages, illustrations (some colour), 29 cm","823.809","YK.2000.b.219","Brontë, Patrick Branwell, 1817-1848--Criticism and interpretation--Juvenile literature ; Great Britain--Social conditions--19th century--Juvenile literature ; Brontë, Anne, 1820-1849--Criticism and interpretation--Juvenile literature ; Brontë, Emily, 1818-1848--Criticism and interpretation--Juvenile literature ; Brontë, Charlotte, 1816-1855--Criticism and interpretation--Juvenile literature","Children's literature","English","",""
