"Jane Eyre : an autobiography","","011400443","Monograph","Language material ; Text","Volume","GB8619470","","9781851520091","Brontë, Charlotte","1816-1855","person","","Brontë, Charlotte, 1816-1855 [person]","Oxford world's classics","","England","London","Chancellor","1985","","ix, 548 pages, 16 cm","823.8","YC.1986.a.3944","Fiction in English--1837-1900--Texts","","English","",""
"Jane Eyre : an autobiography","","015264001","Monograph","Language material ; Text","Volume","GBA963563","","9781906059323","Brontë, Charlotte","1816-1855","person","","Brontë, Charlotte, 1816-1855 [person]","HV Classic Fiction","","England","London","","2007","","523 pages, 24 cm","823.8","H.2009/2656","","","English","",""
"Jane Eyre : an autobiography","","017442503","Monograph","Language material ; Text","Online resource","","","","Brontë, Charlotte","1816-1855","person","","Brontë, Charlotte, 1816-1855 [person]","","","United States of America","New York","Harper","1853","","174 pages, 24 cm","","Digital Store 1570/6121 (1)","","","English","",""
"Jane Eyre : an autobiography","","018048480","Monograph","Language material ; Text","Online resource","","","","Brontë, Charlotte","1816-1855","person","","Brontë, Charlotte, 1816-1855 [person]","","","England","London","Smith, Elder","1850","4th edition","vii, 467, 16 pages, 19 cm","","Digital Store RB.23.a.15921","","","English","With an advertisement (4p.) for the same author's 'Shirley', and 'A catalogue of books ... published by Smith, Elder and Co.' (8p, May 1850.) at end of text",""
"Jane Eyre : an autobiography","","018622288","Monograph","Language material ; Text","Online resource","GBB7N9839","","9781781666487","Brontë, Charlotte","1816-1855","person","","Brontë, Charlotte, 1816-1855 [person]","","","England","Luton","Andrews","2012","","1 online resource","823.8","ELD.DS.230629","Eyre, Jane, (Fictitious character) ; FICTION / Historical ; FICTION / Christian / General ; FICTION / Psychological ; FICTION / Mystery & Detective / Hard-Boiled ; FICTION / Science Fiction / General ; England--Social life and customs--Fiction ; Eyre, Jane (Fictitious character)--Fiction ; Mentally ill women ; Governesses--Fiction ; Manners and customs ; Fiction--Classics ; FICTION / Biographical ; FICTION / Jewish ; FICTION / Political ; FICTION / Suspense ; FICTION--Classics ; FICTION / Fantasy / General ; Mentally ill women--Fiction ; FICTION / Occult & Supernatural ; FICTION / Religious ; Orphans--Fiction ; Fiction--Romance--Historical ; FICTION / Medical","Bildungsroman ; Fiction","English","",""
"Jane Eyre : an opera in 2 acts","Jane Eyre ; Jane Eyre. Vocal score","014482569","Monograph","Notated music","Volume","","","","Berkeley, Michael","","person","","Brontë, Charlotte, 1816-1855 [person] ; Malouf, David, 1934- [person] ; Berkeley, Michael [person]","","","England","Oxford","Music Hire Library ; Oxford University Press","2000","","1 score (169 pages), 30 cm","782.10264","G.1111.bb. (1.)","Operas--Vocal scores with piano ; Governesses--England--Drama","Drama ; Vocal score","English","Acc. arr. for piano ; Act 1 engraved, act 2 reproduced from manuscript ; Adapted from the novel by Charlotte Brontë",""
"Jane Eyre : an opera in three acts. Act I","Jane Eyre ; Jane Eyre. Act 1","017348649","Monograph","Notated music","Volume","","","","Karchin, Louis","","person","composer","Karchin, Louis, composer [person] ; Osen, Diane, 1956- [person] ; Brontë, Charlotte, 1816-1855 [person]","","","United States of America","New York","American Composers Alliance","2013","Full score","1 score (239 pages), 44 cm","782.1","I.660.x./1","Operas--Excerpts--Scores","Excerpt","English","",""
"Jane Eyre : authoritative text, backgrounds, criticism","","011954209","Monograph","Language material ; Text","Volume","GB9148037","","9780393955897","Brontë, Charlotte","1816-1855","person","","Dunn, Richard J., 1938- [person] ; Brontë, Charlotte, 1816-1855 [person]","A Norton critical edition","","England ; United States of America","London ; New York","Norton","1987","2nd edition","viii, 497 pages, 22 cm","823.8","YC.1991.a.3495","Fathers and daughters--Fiction ; Young women--Fiction ; Married men--Fiction ; Orphans--Fiction ; Governesses--Fiction ; Brontë, Charlotte, 1816-1855 ; English fiction ; Country homes--Fiction ; England--Fiction ; Mentally ill women--Fiction ; Charity-schools--Fiction","Bildungsroman ; Fiction ; Romance fiction","English","",""
"Jane Eyre : complete, authoritative text with biographical and historical contexts, critical history, and essays from five contemporary critical perspectives","","010677024","Monograph","Language material ; Text","Volume","GB9642458","","9780312095451 ; 9780312127954 ; 9780333657034","Brontë, Charlotte","1816-1855","person","","Newman, Beth [person] ; Brontë, Charlotte, 1816-1855 [person]","Case studies in contemporary criticism","","England","Basingstoke ; Boston","Bedford Books of St. Martin's Press ; Macmillan","1996","","x, 646 pages, 21 cm","823.8","YC.1996.a.3161","English fiction ; Brontë, Charlotte, 1816-1855","","English","",""
"Jane Eyre : complete, authoritative text with biographical, historical and cultural contexts, critical history and essays from contemporary critical perspectives","","016714228","Monograph","Language material ; Text","Volume","GBB450744","","9781137414274","Brontë, Charlotte","1816-1855","person","author","Newman, Beth, 1955-, editor [person] ; Brontë, Charlotte, 1816-1855, author [person]","Case studies in contemporary criticism","","England","Boston","Bedford ; St Martin's","2015","2nd revised edition","xiii, 714 pages, black and white illustrations, 21 cm","823.8","H.2015/.7444","Governesses--England--Fiction ; Brontë, Charlotte, 1816-1855 ; England--Social life and customs--Fiction","Fiction","English","Previous edition: Basingstoke: Macmillan, 1996",""
"Jane Eyre : die Waise von Lowood","Jane Eyre. German","000259292","Monograph","Language material ; Text","Volume","","","","Brontë, Charlotte","1816-1855","person","","Brontë, Charlotte, 1816-1855 [person]","","","Germany","Stuttgart","Franckh'sche Verlagshandlung","1864","2nd Auflage","2 volumes, 16 cm","","12637.a.7","","","German","",""
"Jane Eyre : drama ... adapted from Charlotte Bronte's novel, etc","Jane Eyre","000490081","Monograph","Language material ; Text","Volume","","","","Brougham, John, comedian","","person","","Brougham, John, comedian [person] ; Brontë, Charlotte, 1816-1855 [person]","","","United States of America","New York","Samuel French","1865","","32 pages (12°)","","11791.cc.25. (2.)","","","English","",""
"Jane Eyre : drama ... adapted from Charlotte Bronte's novel, etc","Jane Eyre","016906388","Monograph","Language material ; Text","Online resource","","","","Brougham, John, comedian","","person","","Brougham, John, comedian [person] ; Brontë, Charlotte, 1816-1855 [person]","","","United States of America","New York","Samuel French","1865","","32 pages (12°)","","Digital Store 11791.cc.25. (2.)","","","English","",""
"Jane Eyre : dramatised from Charlotte Brontë's novel","Jane Eyre","001866256","Monograph","Language material ; Text","Volume","","","","Jerome, Helen","1883-1958","person","","Jerome, Helen, 1883-1958 [person] ; Brontë, Charlotte, 1816-1855 [person]","French's Acting Edition","","England","London","","1938","","64 pages (8°)","","11791.tt.1/347","","","","",""
"Jane Eyre : from the story by Charlotte Bronte","Jane Eyre","007715259","Monograph","Language material ; Text","Volume","GBA3V6581","","9780746057520","Claybourne, Anna","","person","","Harvey, Bob [person] ; Claybourne, Anna [person] ; Brontë, Charlotte, 1816-1855 [person]","Usborne classics","","England","London","Usborne","2003","","176 pages, colour illustrations, 20 cm","823.914","H.2005/368","Governesses--England--Juvenile fiction ; England--Social life and customs--Juvenile fiction","Children's fiction","English","",""
"Jane Eyre : lurid hieroglyphics","'Indian ink' : colonialism and the figurative strategy of Jane Eyre ; Charlotte Brontë's Jane Eyre ; Fairies and feminism : recurrent patterns in Chaucer's 'The wife of Bath's tale' and Brontë's Jane Eyre ; Jane Eyre ; Jane Eyre and the secrets of furious lovemaking ; St. John's way and the wayward reader ; The enigma of St. John Rivers ; The wild English girl : Jane Eyre ; Thornfield and 'the dream to repose on' : Jane Eyre ; Triumph and jeopardy : the shape of Jane Eyre","013673741","Monograph","Language material ; Text","Volume","GBA713279","","9780791093047","","","","","Bloom, Harold [person]","Bloom's modern critical interpretations","","United States of America","New York","Chelsea House","2007","Updated edition","vii, 235 pages","823.8","YC.2007.a.2495","Governesses in literature ; Brontë, Charlotte, 1816-1855","","English","",""
"Jane Eyre : of het leven eener Gouvernante","Jane Eyre. Dutch","000259289","Monograph","Language material ; Text","Volume","","","","Brontë, Charlotte","1816-1855","person","","Brontë, Charlotte, 1816-1855 [person]","","","Netherlands","Groningen","C.M. Van Bolhuis Hoitsema","1849-1850","","2 volumes in 1 (336 pages), 23 cm","","12641.ccc.30","","","Dutch","",""
"Jane Eyre : of het leven eener Gouvernante","Jane Eyre. Dutch","014804998","Monograph","Language material ; Text","Online resource","","","","Brontë, Charlotte","1816-1855","person","","Brontë, Charlotte, 1816-1855 [person]","","","Netherlands","Groningen","C.M. Van Bolhuis Hoitsema","1849-1850","","2 volumes in 1 (336 pages), 23 cm","","Digital Store 12641.ccc.30","","","Dutch","",""
"Jane Eyre : ou, Mémoires d'une institutrice ... Roman ... Traduit avec l'autorisation de l'auteur par Mme Lesbazeilles-Souvestre, etc","Jane Eyre. French","000259290","Monograph","Language material ; Text","Volume","","","","Brontë, Charlotte","1816-1855","person","","Lesbazeilles, E. (Eugène), 1826- [person] ; Brontë, Charlotte, 1816-1855 [person]","","","France","Paris","","1856","","ii, 459 pages (12°)","","12603.f.4","","","French","",""
"Jane Eyre : ou, Mémoires d'une institutrice ... Roman ... Traduit avec l'autorisation de l'auteur par Mme Lesbazeilles-Souvestre, etc","Jane Eyre. French","018065985","Monograph","Language material ; Text","Online resource","","","","Brontë, Charlotte","1816-1855","person","","Lesbazeilles, E. (Eugène), 1826- [person] ; Brontë, Charlotte, 1816-1855 [person]","","","France","Paris","","1856","","ii, 459 pages (12°)","","Digital Store 12603.f.4","","","French","",""
"Jane Eyre : précédé de, Oeuvres de jeunesse, 1826-1847","Jane Eyre. French ; Poems ; Works","014758757","Monograph","Language material ; Text","Volume","","","9782070114955","Brontë, Charlotte","1816-1855","person","","Brontë, Anne, 1820-1849 [person] ; Jean, Dominique [person] ; Brontë, Patrick Branwell, 1817-1848 [person] ; Brontë, Emily, 1818-1848 [person] ; Brontë, Charlotte, 1816-1855 [person]","Bibliothèque de la Pléiade","542 [Bibliothèque de la Pléiade]","France","Paris","Gallimard","2008","","xxxix, 1723 pages, 18 cm","823.8","YF.2010.a.11485","English literature--Novels--19th century--Critical edition","","French","In slip case ; Translated from the English",""
"Jane Eyre : teacher's book","Jane Eyre","015295502","Monograph","Language material ; Text","Volume","GBA961144","","9781848623392","Dooley, Jenny","","person","","Brontë, Charlotte, 1816-1855 [person] ; Dooley, Jenny [person]","Classic readers","","England","Newbury","Express","2008","","62 pages, illustrations, 21 cm","","","Readers ; English language--Textbooks for foreign speakers","Textbook","English","Cover title ; Previous edition: 2003",""
"Jane Eyre : the graphic novel : original text version","","014531567","Monograph","Language material ; Text","Volume","GBA823341","","9781906332068","Brontë, Charlotte","1816-1855","person","","Corzine, Amy [person] ; Burns, John, 1938- [person] ; Wiley, Terry [person] ; Bryant, Clive [person] ; Brontë, Charlotte, 1816-1855 [person]","","","England","Towcester","Classical Comics","2008","","141 pages, chiefly colour illustrations, 25 cm","741.5","YK.2010.a.5473","England--Social life and customs--Comic books, strips, etc--Juvenile fiction ; Eyre, Jane (Fictitious character)--Comic books, strips, etc--Juvenile fiction ; Governesses--England--Comic books, strips, etc--Juvenile fiction","Children's fiction ; Comic or graphic novel","English","",""
"Jane Eyre : the graphic novel : quick text version","","014531568","Monograph","Language material ; Text","Volume","GBA823342","","9781906332082","Brontë, Charlotte","1816-1855","person","","Corzine, Amy [person] ; Burns, John, 1938- [person] ; Wiley, Terry [person] ; Bryant, Clive [person] ; Brontë, Charlotte, 1816-1855 [person]","","","England","Towcester","Classical Comics","2008","","141 pages, chiefly colour illustrations, 25 cm","741.5","YK.2010.a.5471","England--Social life and customs--Comic books, strips, etc--Juvenile fiction ; Eyre, Jane (Fictitious character)--Comic books, strips, etc--Juvenile fiction ; Governesses--England--Comic books, strips, etc--Juvenile fiction","Children's fiction ; Comic or graphic novel","English","",""
"Jane Eyre : the graphic novel","","015492885","Monograph","Language material ; Still image ; Text","Computer disc ; Volume","GBB525206","","9781907127021","Calway, Gareth","1956-","person","author","Calway, Gareth, 1956-, author [person]","Classical Comics teaching resource pack","","England","Litchborough, Towcester","Classical Comics","2009","UK edition","102 pages, illustrations, 30 cm + 1 CD","823.8","EMC.2013.b.70","Brontë, Charlotte, 1816-1855","","English","'Suitable for teaching ages 10-17.'",""
"Jane Eyre : the graphic novel, Charlotte Brontë","","015268730","Monograph","Language material ; Text","Volume","GBB605183","","9781906332129","Calway, Gareth","1956-","person","","Burns, John, 1938- [person] ; Calway, Gareth, 1956- [person]","Classical Comics study guide","","England","Towcester","Classical Comics","2008","","96 pages, illustrations, portraits, 30 cm","823.8","YKL.2016.b.649","Brontë, Charlotte, 1816-1855--Study and teaching (Secondary)--Activity programs--Great Britain","","English","Spiral-bound ; Suitable for teaching ages 10-17",""
"Jane Eyre : to which is added The Moores, an unpublished fragment ... With introduction by W. Robertson Nicoll","Moors","000485606","Monograph","Language material ; Text","Volume","","","","Brontë, Charlotte","1816-1855","person","","Nicoll, W. Robertson (William Robertson), Sir, 1851-1923 [person] ; Brontë, Charlotte, 1816-1855 [person]","","","England","London","Hodder & Stoughton","1902","","xxiv 544 pages (8°)","","012622.h.7","","","","volume 1 of a projected edition of the Works of Charlotte Brontë",""
"Jane Eyre and Hathersage","","007447097","Monograph","Language material ; Text","Volume","GB8339562","","9780907602095","Hulbert, M. F. H.","","person","","Hulbert, M. F. H. [person]","","","England","Sheffield","Hathersage Parochial Church Council","1983","","16 pages, illustrations, 1 map, 1 portrait, 22 cm","823.8","X.809/56306","Hathersage (Derbyshire)--Description ; Fiction in English--Brontë, Charlotte--Jane Eyre--Local associations--Derbyshire--Hathersage ; Brontë, Charlotte, 1816-1855 ; Brontë, Charlotte, 1816-1855--Journeys--England--Hathersage","","English","Text and map on inside covers",""
"Jane Eyre and Hathersage","","010552603","Monograph","Language material ; Text","Volume","GB8118657","","","Hulbert, M. F. H.","","person","","Hulbert, M. F. H. [person]","","","England","Hathersage ; Vicarage, Hathersage, Sheffield S30 1AB","Hathersage Parochial Church Council","1980","","8 pages, illustrations, 1 portrait, 22 cm","823.8","X.200/35544","Hathersage (Derbyshire)--Description ; Fiction in English--Brontë, Charlotte--Jane Eyre--Local associations--Derbyshire--Hathersage ; Brontë, Charlotte, 1816-1855 ; Brontë, Charlotte, 1816-1855--Journeys--England--Hathersage","","English","",""
"Jane Eyre and the secrets of furious lovemaking","'Indian ink' : colonialism and the figurative strategy of Jane Eyre ; Charlotte Brontë's Jane Eyre ; Fairies and feminism : recurrent patterns in Chaucer's 'The wife of Bath's tale' and Brontë's Jane Eyre ; Jane Eyre ; Jane Eyre : lurid hieroglyphics ; St. John's way and the wayward reader ; The enigma of St. John Rivers ; The wild English girl : Jane Eyre ; Thornfield and 'the dream to repose on' : Jane Eyre ; Triumph and jeopardy : the shape of Jane Eyre","013673741","Monograph","Language material ; Text","Volume","GBA713279","","9780791093047","","","","","Bloom, Harold [person]","Bloom's modern critical interpretations","","United States of America","New York","Chelsea House","2007","Updated edition","vii, 235 pages","823.8","YC.2007.a.2495","Governesses in literature ; Brontë, Charlotte, 1816-1855","","English","",""
"Jane Eyre by Charlotte Brontë","Jane Eyre","010056188","Monograph","Language material ; Text","Volume","GB8800680","","9780333434093","Miles, Robert","1953-","person","","Miles, Robert, 1953- [person] ; Brontë, Charlotte, 1816-1855 [person]","Macmillan master guides","","England","Basingstoke","Macmillan","1988","","viii, 88 pages, 22 cm","823.8","YC.1988.a.14932","Fiction in English--Brontë, Charlotte--1816-1855 ; Brontë, Charlotte, 1816-1855","","English","",""
"Jane Eyre for GCSE","","017765686","Monograph","Language material ; Text","Volume","GBB634015","","9781471853609","Jones, Mike","","person","author","Jones, Mike, author [person]","Study and revise for GCSE","","England","London","Hodder Education","2016","","1 volume, 25 cm","823.8","","English fiction--19th century--Examinations--Study guides ; Brontë, Charlotte, 1816-1855","Study guide","English","Additional physical form: ebook version. 9781471854569",""
"Jane Eyre for GCSE","","017978859","Monograph","Language material ; Text","Online resource (ePub ebook)","GBB6B5007","","9781471854569","Jones, Mike","","person","author","Jones, Mike, author [person]","Study and revise for GCSE","","England","London","Hodder Education","2016","","1 online resource","823.8","ELD.DS.86267","English fiction--19th century--Examinations--Study guides ; Brontë, Charlotte, 1816-1855","Study guide","English","Additional physical form: Print version. 9781471853609",""
"Jane Eyre in half the time","","013746150","Monograph","Language material ; Text","Volume","GBA736988","","9780753822784","Brontë, Charlotte","1816-1855","person","","Brontë, Charlotte, 1816-1855 [person]","Compact editions","","England","London","Phoenix","2007","","1 volume, 20 cm","823.8","","Governesses--England--Fiction ; England--Social life and customs--Fiction","Fiction","English","",""
"Jane Eyre laid bare : the classic novel with an erotic twist","","016135886","Monograph","Language material ; Text","Volume","GBB275140","","9781447229285","Sinclair, Eve","","person","","Sinclair, Eve [person] ; Brontë, Charlotte, 1816-1855 [person]","","","England","London","","2012","","321 pages, 20 cm","813.6","H.2013/.6988","","Erotic fiction","English","",""
"Jane Eyre laid bare : the classic novel with an erotic twist","","018187028","Monograph","Language material ; Text","Online resource","GBB713167","","9780230768840","Sinclair, Eve","","person","","Sinclair, Eve [person] ; Brontë, Charlotte, 1816-1855 [person]","","","England ; United Kingdom","London","","2012","","1 online resource (360 pages)","813.6","ELD.DS.112368","Historical Romance ; Erotica / General ; Historical Fiction","Erotic fiction","English","",""
"Jane Eyre laid bare : the classic novel with an erotic twist","Jane Eyre","017009996","Monograph","Language material ; Text","Volume","GBB505128","","9781447292548","Sinclair, Eve","","person","author","Brontë, Charlotte, 1816-1855 [person] ; Sinclair, Eve, author [person]","","","England","London","Macmillan","2015","","1 volume, 24 cm","813.6","","","Erotic fiction","English","Originally published: London: Pan, 2012",""
"Jane Eyre on stage, 1848-1898 : an illustrated edition of eight plays with contextual notes","Jane Eyre","013710390","Monograph","Language material ; Text","Volume","GBA748823","","9780754603481","","","","","Stoneman, Patsy [person] ; Brontë, Charlotte, 1816-1855 [person]","The nineteenth century series","","England","Aldershot","Ashgate","2007","","xi, 440 pages, illustrations, 24 cm","822.808351","YC.2007.a.13489 ; m07/.25863","Governesses--Drama ; Eyre, Jane (Fictitious character)--Drama ; English drama--19th century ; Brontë, Charlotte, 1816-1855--Adaptations","Adaptation ; Drama","English","",""
"Jane Eyre on stage, 1848-1898 : an illustrated edition of eight plays with contextual notes","Jane Eyre","018255081","Monograph","Language material ; Text","Online resource","GBB799403","","9781351925631","","","","","Stoneman, Patsy [person] ; Brontë, Charlotte, 1816-1855 [person]","The nineteenth century series","","","","Routledge","2017","","1 online resource (456 pages)","822.808351","ELD.DS.122757","Governesses--Drama ; Eyre, Jane (Fictitious character)--Drama ; English drama--19th century ; Brontë, Charlotte, 1816-1855--Adaptations","Adaptation ; Drama","English","",""
"Jane Eyre ou Mémoires d'une gouvernante","Jane Eyre. French","014603717","Monograph","Language material ; Text","Volume","","","","Brontë, Charlotte","1816-1855","person","","Brontë, Charlotte, 1816-1855 [person]","","","France","Paris","L. Hachette","1855","","183 pages","","RB.23.a.31799","","","French","",""
"Jane Eyre ou Mémoires d'une gouvernante","Jane Eyre. French","018051026","Monograph","Language material ; Text","Online resource","","","","Brontë, Charlotte","1816-1855","person","","Brontë, Charlotte, 1816-1855 [person]","","","France","Paris","L. Hachette","1855","","183 pages","","Digital Store RB.23.a.31799","","","French","",""
"Jane Eyre","","000259286","Monograph","Language material ; Text","Volume","","","","Brontë, Charlotte","1816-1855","person","","Brontë, Charlotte, 1816-1855 [person]","","","England","London","Smith, Elder","1855","5th edition","vii, 467 pages (8°)","","RB.23.a.22635","","","English","",""
"Jane Eyre","","000259288","Monograph","Language material ; Text","Volume","","","","Brontë, Charlotte","1816-1855","person","","Brontë, Charlotte, 1816-1855 [person]","","","United States of America","Philadelphia","R.M. Lindsay","1884","Haworth edition","2 volumes, illustrations, 24 cm","","12602.k.8","","","English","",""
"Jane Eyre","","000485592","Monograph","Language material ; Text","Volume","","","","Brontë, Charlotte","1816-1855","person","","Brontë, Charlotte, 1816-1855 [person]","","","England","London","Smith, Elder","1889","","464 pages (8°)","","012635.a.5","","","","",""
"Jane Eyre","","000485593","Monograph","Language material ; Text","Volume","","","","Brontë, Charlotte","1816-1855","person","","Brontë, Charlotte, 1816-1855 [person]","","","England","London","G. Routledge","1889","","189 pages (8°)","","12624.f.8","","","English","",""
"Jane Eyre","","000485594","Monograph","Language material ; Text","Volume","","","","Brontë, Charlotte","1816-1855","person","","Townsend, Frederick Henry [person] ; Brontë, Charlotte, 1816-1855 [person]","","","England","London","Service & Paton","1896","","ix 436 pages (8°)","","012621.h.23","","","English","",""
"Jane Eyre","","000485595","Monograph","Language material ; Text","Volume","","","","Brontë, Charlotte","1816-1855","person","","Garrett, Edmund Henry [person] ; Brontë, Charlotte, 1816-1855 [person]","","","England","London","Walter Scott","1897","","2 parts (8°)","","12624.d.15","","","English","",""
"Jane Eyre","","000485596","Monograph","Language material ; Text","Volume","","","","Brontë, Charlotte","1816-1855","person","","Brontë, Charlotte, 1816-1855 [person]","","","England","London","George Newnes","1898","","vii 424 pages (8°)","","012621.l.23","","","English","",""
"Jane Eyre","","000485597","Monograph","Language material ; Text","Volume","","","","Brontë, Charlotte","1816-1855","person","","Brontë, Charlotte, 1816-1855 [person] ; Leask, William Keith [person]","","","England","London","Gresham","1899","","xxi 393 pages (8°)","","012622.i.4","","","English","",""
"Jane Eyre","","000485599","Monograph","Language material ; Text","Volume","","","","Brontë, Charlotte","1816-1855","person","","Brontë, Charlotte, 1816-1855 [person]","","","England","London","G. Routledge","1889","New edition","468 pages (8°)","","012611.i.4","","","","",""
"Jane Eyre","","000485600","Monograph","Language material ; Text","Volume","","","","Brontë, Charlotte","1816-1855","person","","Brontë, Charlotte, 1816-1855 [person]","Cassell's Red Library","","England","London","","1890","","382 pages (8°)","","12600.ccc.20","","","","",""
"Jane Eyre","","000485601","Monograph","Language material ; Text","Volume","","","","Brontë, Charlotte","1816-1855","person","","Brontë, Charlotte, 1816-1855 [person]","","","England","London","Ward, Lock","1890","","271 pages (8°)","","012611.l.5","","","","",""
"Jane Eyre","","000485602","Monograph","Language material ; Text","Volume","","","","Brontë, Charlotte","1816-1855","person","","Brontë, Charlotte, 1816-1855 [person]","","","England","London","Howe","1891","","320 pages (16°)","","012611.de.21","","","","",""
"Jane Eyre","","000485603","Monograph","Language material ; Text","Volume","","","","Brontë, Charlotte","1816-1855","person","","Brontë, Charlotte, 1816-1855 [person]","","","England","London","G. Routledge","1892","","189 pages (8°)","","012611.k.24","","","","A reissue of the edition of 1889",""
"Jane Eyre","","000485604","Monograph","Language material ; Text","Volume","","","","Brontë, Charlotte","1816-1855","person","","Brontë, Charlotte, 1816-1855 [person]","","","England","London","R. E","1893","","468 pages (8°)","","012621.g.3","","","English","",""
